ref0330;Défrisant Sans Soude Dark and Lovely ;;Voir les détails;defrisant-sans-soude-kit-super--dark-and-lovely--p-image-259811-petite.png
ref0331;Défrisant Cheveux Enfants - Beautiful Beginnings;;Voir les détails;defrisant-cheveux-enfants--beautiful-beginnings-p-image-259790-petite.png
ref0332;Défrisage Regular Dark and Lovely;;Nutrition et douceur garanties avec ce Shampooing Fortifiant Actiforce qui nettoie le cuir chevelu en doucuer et le libère des impuretés tout en fortifiant les longueurs. 98% d\'origine naturelle, sans paraben, silicone, ni sulfate.;defrisage-regular-dark-and-lovely-p-image-260352-petite.png
ref0333;Kit Défrisant Olive Oil Normal;;Hair Cleansing Cream de Jessicurl est un shampooing crémeux qui mousse peu mais nettoie et assouplit efficacement les textures épaisses, ultra sèches et les cheveux colorés.;kit-defrisant-olive-oil-normal-p-image-265925-petite.png
ref0334;Modes de paiement et d\'expédition;;Voir les détails;modes-de-paiement-et-d-expedition-image-265840-moyenne.png
ref0335;Laques et cires coiffantes;;shampooing cheveux crépus;laques-et-cires-coiffantes-image-264089-moyenne.jpg
ref0336;Brillantine Végétale NATURAL TOUCH;;shampoing KeraCare sans sulfate, nettoie, démêle, et assouplit avec efficacité;brillantine-vegetale-natural-touch-p-image-260009-petite.png
ref0337;HAIRFOOD ACTIFORCE;;Un shampoing à la texture crèmeuse douce pour nettoyer sans irriter ni dessécher les cheveux les plus secs et fragiles, hydratation en profondeur des cheveux.;hairfood-actiforce-p-image-267048-petite.png
ref0338;Glossing Polisher Sérum Haute Brillance Organic Root Stimulator;;Raw Shea Butter - Shampooing de rétention d\'humidité il hydrate, adoucit et comble les brèches , laisse les cheveux maniables et soyeux. ;glossing-polisher-serum-haute-brillance-organic-root-stimulator-p-image-257556-petite.png
ref0339;Cire Magic Coiffante SJR sjr006;;Un shampoing reconstructeur sans sulfates qui élimine l\'accumulation de produits, tout en hydratant le cuir chevelu. Un soin cheveu intégral qui renforce la fibre capillaire de l\'intérieur. Excellent pour les cheveux affaiblis, abîmés, cassants et fourchus. ;cire-magic-coiffante-sjr-p-image-263601-petite.png
ref0340;Beurre Capillaire Karité Mangue Coco La Kaz Naturelle ;;Shampooing doux hydratant et relaxant. réhydrate et assouplit la fibre capillaire des cheveux frisés, secs à très secs, crépus et indisciplinés. ;beurre-capillaire-karite-mangue-coco-la-kaz-naturelle-----p-image-264323-petite.png
ref0341;Laque Lubrifiante Anti-Humidité Keracare;;Voir les détails;laque-lubrifiante-anti-humidite-keracare-p-image-258274-petite.png
ref0342;Cire Sweet Shine 50 ml Les Secrets de Loly;;Shampooing solide au Karité Equitable ;cire-sweet-shine-50-ml-p-image-258347-petite.png
ref0343;Laque Cuir Chevelu Sec & Irrité Keracare;;Voir les détails;laque-cuir-chevelu-sec-et-irrite-keracare-p-image-258682-petite.png
ref0344;Lotion fixante Twist and Setting ;;Voir les détails;lotion-fixante-twist-and-setting--p-image-260390-petite.png
ref0345;Silken Seal Liquid Sheen Keracare;;Voir les détails;silken-seal-liquid-sheen-keracare-p-image-258281-petite.png
ref0346;Modes de paiement et d\'expédition;;Shampooing Crème au Karité Equitable La Kaz Naturelle;modes-de-paiement-et-d-expedition-image-265840-moyenne.png
ref0347;Soins Thermoprotecteurs;;shampooing cheveux crépus;soins-thermoprotecteurs-image-264083-moyenne.jpg
ref0348;Strengthen Grow & Restore Styling Lotion - Jamaican Black Castor Oil Shea Moisture;;shampoing KeraCare sans sulfate, nettoie, démêle, et assouplit avec efficacité;strengthen-grow---restore-styling-lotion-jamaican-black-castor-oil-p-image-266662-petite.png
ref0349;Soin Pré-Shampooing Thermal Wonder ;;Voir les détails;soin-pre-shampooing-thermal-wonder---p-image-267022-petite.png
ref0350;Masque Spray Multi-Soin Activilong Actiliss ;;Un shampoing à la texture crèmeuse douce pour nettoyer sans irriter ni dessécher les cheveux les plus secs et fragiles, hydratation en profondeur des cheveux.;masque-spray-multi-soin-activilong-actiliss--p-image-260834-petite.png
ref0351;Fondant Magic de Coiffage SJR à la Kératine sjr005;;Le Shampoing Curl and Shine à base d\'hibiscus démêle, hydrate et définit les boucles en restaurant la fibre capillaire et la brillance. L\'huile de Coco nourrit en profondeur, les protéines de soie renforcent, l\'huile de Neem laisse le cheveu sain et brillant.;fondant-magic-de-coiffage-sjr-a-la-keratine-p-image-263600-petite.png
ref0352;Sérum de Protection Thermique;;Shampooing Bio à l\'huile de Moringa, dès 3 ans. pour les cheveux secs à très secs ;serum-de-protection-thermique--p-image-257547-petite.png
ref0353;Sérum Lissant Activilong ActiLiss;;Shampooing doux hydratant et relaxant. réhydrate et assouplit la fibre capillaire des cheveux frisés, secs à très secs, crépus et indisciplinés. ;serum-lissant-activilong-actiliss-p-image-260025-petite.png
ref0354;Hair Silk Mixed Chicks;;Savon Noir naturel Dudu Osun 25 grammes en format découverte. ;hair-silk--mixed-chicks-p-image-259870-petite.png
ref0355;Straightening Serum Mixed Chicks;;Voir les détails;straightening-serum-mixed-chicks-p-image-259191-petite.png
ref0356;Sérum Lissant Magic SJR à la Kératine sjr007;;Shampooing solide au Karité Equitable ;serum-lissant-magic-sjr-a-la-keratine--p-image-263602-petite.png
ref0357;Silken Seal Liquid Sheen Keracare;;Shampooing Activateur de Boucles ACTICURL;silken-seal-liquid-sheen-keracare-p-image-258281-petite.png
ref0358;Protecteur Thermique 6 en 1 Thermal Wonder ;;Shampooing conditionneur à l\'Aloé, hydratant et protecteur, et à la fleur d\' Hibiscus, qui hydrate, renforce et assainit. Une texture crème qui ne mousse pas mais lave en douceur. Laisse les cheveux faciles à démêler, leur apporte un toucher soyeux et une belle brillance même sans après-shampoing !;protecteur-thermique-6-en-1-thermal-wonder--p-image-267023-petite.png
ref0359;Protecteur thermal renforcateur Keracare;;Voir les détails;protecteur-thermal-renforcateur--p-image-259228-petite.png
ref0360;Crème Etanche Soyeuse pour Brushing Keracare;;Le Savon Nuage de Coco, c\'est 100 g de pure bonheur sur les épidermes les plus secs, sensibles et fragiles des enfants comme des adultes. A base de beurres végétaux bio de Karité et de Cacao, d\'huiles bio de Chanvre et Noyaux d\'Abricot et de Lait de Coco, ce savon est 100 % naturel. Extra riche, il ne contient ni parfum ni huiles essentielles. ;creme-etanche-soyeuse-pour-brushing-keracare-p-image-258280-petite.png
ref0361;Programme Lissant Thermal Wonder Keracare;;Hair Cleansing Cream de Jessicurl est un shampooing crémeux qui mousse peu mais nettoie et assouplit efficacement les textures épaisses, ultra sèches et les cheveux colorés.;programme-lissant-thermal-wonder-keracare-p-image-267025-petite.png
ref0362;Modes de paiement et d\'expédition;;Shampooing sec idéal pour tresses, vanilles ou locks. ;modes-de-paiement-et-d-expedition-image-265840-moyenne.png
ref0363;Huiles capillaires;;shampooing cheveux crépus;huiles-capillaires-image-264088-moyenne.jpg
ref0364;Reconstructive Elixir Raw Shea Butter de Shea Moisture;;shampoing KeraCare sans sulfate, nettoie, démêle, et assouplit avec efficacité;reconstructive-elixir-raw-shea-butter-de-shea-moisture-p-image-266650-petite.png
ref0365;Sérum de réparation cheveux et cuir chevelu Raw Shea Butter Shea Moisture;;Voir les détails;serum-de-reparation-cheveux-et-cuir-chevelu-raw-shea-butter-shea-moisture-p-image-266663-petite.png
ref0366;Pure GLYCERINE VEGETALE Activilong 75 ml;;Un shampoing à la texture crèmeuse douce pour nettoyer sans irriter ni dessécher les cheveux les plus secs et fragiles, hydratation en profondeur des cheveux.;pure-glycerine-vegetale--activilong--75-ml-p-image-267767-petite.png
ref0367;Pure Huile d\'OLIVE Activilong 75 ml;;Raw Shea Butter - Shampooing de rétention d\'humidité il hydrate, adoucit et comble les brèches , laisse les cheveux maniables et soyeux. ;pure-huile-d-olive-activilong-75-ml-p-image-267773-petite.png
ref0368;Pure Huile de RICIN Activilong 75 ml;;Le Shampoing Curl and Shine à base d\'hibiscus démêle, hydrate et définit les boucles en restaurant la fibre capillaire et la brillance. L\'huile de Coco nourrit en profondeur, les protéines de soie renforcent, l\'huile de Neem laisse le cheveu sain et brillant.;pure-huile-de-ricin-activilong--75-ml-p-image-267775-petite.png
ref0369;Pure Huile de COCO Activilong 75 ml;;Un shampoing reconstructeur sans sulfates qui élimine l\'accumulation de produits, tout en hydratant le cuir chevelu. Un soin cheveu intégral qui renforce la fibre capillaire de l\'intérieur. Excellent pour les cheveux affaiblis, abîmés, cassants et fourchus. ;pure-huile-de-coco-activilong--75-ml-p-image-267770-petite.png
ref0370;Pure Huile de KARITE Activilong 75 ml;;Shampooing Bio à l\'huile de Moringa, dès 3 ans. pour les cheveux secs à très secs ;pure-huile-de-karite-activilong---75-ml-p-image-267772-petite.png
ref0371;Pure Huile d\'Avocat Activilong 75 ml;;Shampooing doux hydratant et relaxant. réhydrate et assouplit la fibre capillaire des cheveux frisés, secs à très secs, crépus et indisciplinés. ;pure-huile-d-avocat-activilong-75-ml-p-image-267768-petite.png
ref0372;Pure Huile de MACADAMIA Activilong 75 ml;;Savon Noir naturel Dudu Osun 25 grammes en format découverte. ;pure-huile-de-macadamia-activilong---75-ml-p-image-267774-petite.png
ref0373;Bain d\'huiles Africaines Avocat et Baobab La Kaz Naturelle;;Voir les détails;bain-d-huiles-africaines-avocat-et-baobab-la-kaz-naturelle-p-image-268030-petite.png
ref0374;Bain d\'huiles Ayurvédiques Amla et Brahmi La Kaz Naturelle;;Shampooing solide au Karité Equitable ;bain-d-huiles-ayurvediques-amla-et-brahmi-la-kaz-naturelle-p-image-267995-petite.png
ref0375;Pure Huile JOJOBA Activilong 75 ml;;Voir les détails;pure-huile-jojoba--activilong--75-ml-p-image-267765-petite.png
ref0376;Pure Huile d\'AMANDE DOUCE Activilong 75 ml;;Shampooing Activateur de Boucles ACTICURL;pure-huile-d-amande-douce-activilong-75-ml-p-image-267769-petite.png
ref0377;Huile pure de Carapate ACTIFORCE;;Voir les détails;huile-pure-de-carapate-actiforce-p-image-267050-petite.png
ref0378;Pure Huile d\'ARGAN Activilong 75 ml;;Shampooing conditionneur à l\'Aloé, hydratant et protecteur, et à la fleur d\' Hibiscus, qui hydrate, renforce et assainit. Une texture crème qui ne mousse pas mais lave en douceur. Laisse les cheveux faciles à démêler, leur apporte un toucher soyeux et une belle brillance même sans après-shampoing !;pure-huile-d-argan-activilong-75-ml-p-image-267766-petite.png
ref0379;HUILE DE MOUTARDE Waam;;Voir les détails;huile-de-moutarde-waam-p-image-265992-petite.png
ref0380;Huile de Ricin WAAM;;Nutrition et douceur garanties avec ce Shampooing Fortifiant Actiforce qui nettoie le cuir chevelu en doucuer et le libère des impuretés tout en fortifiant les longueurs. 98% d\'origine naturelle, sans paraben, silicone, ni sulfate.;huile-de-ricin--waam-p-image-261060-petite.png
ref0381;HUILE de Pépin de Raisins;;Hair Cleansing Cream de Jessicurl est un shampooing crémeux qui mousse peu mais nettoie et assouplit efficacement les textures épaisses, ultra sèches et les cheveux colorés.;huile-de-pepin-de-raisins-p-image-262724-petite.png
ref0382;BAIN D\'HUILES ACTIFORCE;;Le Shampooing Actiliss est enrichi à l\'huile d\'argan Bio, à la kératine pure et aux protéines de lait Bio. Il nourrit les cheveux, prolonge les effets du lissage et rend les cheveux doux et soyeux. ;bain-d-huiles-actiforce-p-image-267047-petite.png
ref0383;Huile de Karité Oléique Waam;;Voir les détails;huile-de-karite-oleique--waam-p-image-261059-petite.png
ref0384;Huile de Coco WAAM;;Extrêmement doux et sans aucun apport chimique, le savon noir African Black Soap Aviela s\'utilise sur la peau et sur les cheveux. Purifiant et antiseptique il préserve la jeunesse de la peau et laisse le teint lumineux.;huile-de-coco--waam-p-image-261061-petite.png
ref0385;Huile d\'Avocat 100ml Waam;;Shampooing Crème au Karité Equitable La Kaz Naturelle;huile-d-avocat-100ml-p-image-261064-petite.png
ref0386;Bain Magic d\'huiles végétales SJR;;Voir les détails;bain-magic-d-huiles-vegetales-sjr-p-image-263598-petite.png
ref0387;HUILES ESSENTIELLES POUR CHEVEUX 120ml;;Voir les détails;huiles-essentielles-pour-cheveux-120ml-p-image-264031-petite.png
ref0388;Bain Fleuri Les Délices d\'Azylis;;Voir les détails;bain-fleuri-les-delices-d-azylis-p-image-264909-petite.png
ref0389;Bain Sucré Les Délices d\'Azylis;;Voir les détails;bain-sucre-les-delices-d-azylis-p-image-265722-petite.png
ref0390;Shea Coco Monoi Oil Natural Serum Taliah Wajid;;La Crème lavante douce d\'ACTIFORCE élimine les impuretés du cuir chevelu tout en douceur et procure un boost aux protéines végétales sans alourdir la chevelure. Grâce à sa texture non moussante et extra-douce, les noeuds sont limités et les cheveux démêlés pour favoriser la formation de belles boucles.;shea-coco-monoi-oil-natural-serum-taliah-wajid-p-image-265862-petite.png
ref0391;Stimulating Scalp Massage Oil Jessicurl;;shampoing clarifiant organic root stimulator à utiliser en alternance. Stimulant et revitalisant. Il élimine les résidus chimiques accumulés. Les pores obstrués se libèrent. il est adapté aux cheveux secs et défrisés;stimulating-scalp-massage-oil-jessicurl-p-image-260568-petite.png
ref0392;Oil Blend Jessicurl;;Voir les détails;oil-blend-jessicurl-p-image-260551-petite.png
ref0393;Sérum Végétal Actif EBENE;;Shampoing Clean & Natural Herbal Hair Wash Taliah Waajid;serum-vegetal-actif-ebene-p-image-260021-petite.png
ref0394;HUILE de Carotte 100% végétale ;;Voir les détails;huile-de-carotte-100--vegetale----p-image-262725-petite.png
ref0395;Sérum Huileux Nappy Queen;;Voir les détails;serum-huileux-nappy-queen-p-image-266895-petite.png
ref0396;Huile de Noix de Coco Extra Vierge BIO ;;Ce shampooing purifiant Africare assure un nettoyage en profondeur. Il élimine en douceur les impuretés sans décaper. Les cheveux et le cuir chevelu sont assainis de la racine à la pointe. Particulièrement adapté aux cheveux frisés, secs, crépus et les toutes les coiffures africaines : tresses, vanilles, locks.;huile-de-noix-de-coco-extra-vierge-bio--p-image-266836-petite.png
ref0397;FANTASTIC OIL ®ACTIREPAIR ;;Herbal Cleanse Shampooing sec pour tresses et locks;fantastic-oil-actirepair--p-image-260024-petite.png
ref0398;Huile de Jojoba Waam;;Voir les détails;huile-de-jojoba--waam-p-image-261063-petite.png
ref0399;HUILE de NIGELLE Pure ;;Shampooing clarifiant locks et cheveux crépus. Il élimine les résidus de coiffage, assainit et stimule le cuir chevelu.;huile-de-nigelle-pure-p-image-266944-petite.png
ref0400;huile d\'argan waam;;Voir les détails;huile-d-argan-100ml-p-image-261062-petite.png
ref0401;HUILE DE BAOBAB Waam;;nettoie les cheuveux.réhausse, prolonge et hydrate les cheveux colorés;huile-de-baobab-waam-p-image-265990-petite.png
ref0402;Huile de Carapate ;; Pour nettoyer en douceur et apporter brillance et hydratation aux cheveux crépus, frisés. Enrichi en acides aminés de soie. ;huile-de-carapate-p-image-260650-petite.png
ref0403;Root2Tip Root Energizer;;Formulé à base d\'ingrédients naturels comme le Miel, le beurre de Karité, les extraits d\'Amla et de Shikakai, le Neem, les huiles d\'Argan, d\'Abyssinie et de Ricin, Honey Shea Co-Wash de Keracare Natural Textures lave efficacement et en douceur les cheveux afro. Ils sont plus forts, plus brillants et plus faciles à démêler. ;root2tip-root-energizer-p-image-260442-petite.png
ref0404; Huile de Ricin et Beurre de Karité Waam;;Voir les détails;huile-de-ricin-et-beurre-de-karite-waam-p-image-257680-petite.png
ref0405;Huile de Karité Oléique et Pur Beurre de Karité;;Crème sucrée Les Délices d\'Azylis;huile-de-karite-oleique-et-pur-beurre-de-karite-p-image-260045-petite.png
ref0406;Huile de Coco 100ml et Beurre de Karité 100gr;;Cette base shampooing sans sulfate produit une mousse abondante pour nettoyer et démêler les cheveux en profondeur sans dessécher. Neutre et enrichie en Aloe et glycérine végétale, elle convient à un usage fréquent, pour toute la famille. -;huile-de-coco-100ml-et-beurre-de-karite-100gr-p-image-258663-petite.png
ref0407;Huile d\' avocat 100ml et Beurre de Karité 100gr;;Curl Clarity de AS I AM est un shampoing clarifiant qui nettoie et élimine tous les résidus et produits accumulés sur votre cuir chevelu. Sans sulfate, il préserve la couleur des cheveux colorés et permet à vos boucles de retrouver leur vigueur.;huile-d--avocat-100ml-et-beurre-de-karite-100gr-p-image-261155-petite.png
ref0408;Synergie d\'huiles Capillaires Noire o Naturel;;shampoing Sans silicone. Idéal cheveux afro. Il pénètre en profondeur pour restaurer l\'hydratation, restructurer et promouvoir une croissance plus active.;bain-d-huile-pour-cheveux--secheresse-du-cheveu--soin-cheveux-afros--soins-bio-p-image-260902-petite.png
ref0409;Huile Capillaire De Croissance Les Secrets de Loly;;Le shampoing détoxifie nettoie et purifie le cuir chevelu grace à sont actif bio anti pelliculaire le bois de panama complété par les poudres de coco et bambou qui vont gommer et éliminer toutes les impuretés collées aux racines. Il contient également un actif naturel, le syricalm qui apaise les cuirs chevelu les plus irrités et fragilisés.;huile-capillaire-de-croissance--p-image-261077-petite.png
ref0410;Huile de Jojoba 100ml et Beurre de Karité 100gr;;Shampoing clarifiant détoxifiant sans sulfate pour cheveux afro, crépus, frisés ou bouclés. ;huile-de-jojoba-100ml-et-beurre-de-karite-100gr-p-image-261082-petite.png
ref0411;Huile d\'Argan 100ml et Beurre de Karité 100g;; shampoing qui traite avec efficacité les pellicules sur cheveux afro et évitent les recidives;huile-d-argan-100ml-et-beurre-de-karite-100g-p-image-261083-petite.png
ref0412;Modes de paiement et d\'expédition;;Voir les détails;modes-de-paiement-et-d-expedition-image-265840-moyenne.png
ref0413;Traitement capillaires;;shampooing cheveux crépus;traitement-capillaires-image-264084-moyenne.jpg
ref0414;Leave In Jamaican Black Castor Oil de Shea Moisture;;shampoing KeraCare sans sulfate, nettoie, démêle, et assouplit avec efficacité;leave-in-jamaican-black-castor-oil-de-shea-moisture-p-image-266660-petite.png
ref0415;Sérum de réparation cheveux et cuir chevelu Raw Shea Butter Shea Moisture;;Voir les détails;serum-de-reparation-cheveux-et-cuir-chevelu-raw-shea-butter-shea-moisture-p-image-266663-petite.png
ref0416;Apres-shampoing activateur de pousse et restructurant Jamaïcan Black Castor Oil;;Un shampoing à la texture crèmeuse douce pour nettoyer sans irriter ni dessécher les cheveux les plus secs et fragiles, hydratation en profondeur des cheveux.;apres-shampoing-activateur-de-pousse-et-restructurant-jamaican-black-castor-oil-p-image-266665-petite.jpg
ref0417;Sérum Anti Chute Fortifiant et Protecteur Dark and Lovely BRAIDS\'N WEAVES;;Raw Shea Butter - Shampooing de rétention d\'humidité il hydrate, adoucit et comble les brèches , laisse les cheveux maniables et soyeux. ;serum-anti-chute-fortifiant-et-protecteur-dark-and-lovely-braids-n-weaves-p-image-261093-petite.png
ref0418;EAU FLORALE de MENTHE POIVRÉE WAAM;;Un shampoing reconstructeur sans sulfates qui élimine l\'accumulation de produits, tout en hydratant le cuir chevelu. Un soin cheveu intégral qui renforce la fibre capillaire de l\'intérieur. Excellent pour les cheveux affaiblis, abîmés, cassants et fourchus. ;eau-florale-de-menthe-poivree-waam-p-image-266542-petite.png
ref0419;ors fertilizing serum;;Shampooing Bio à l\'huile de Moringa, dès 3 ans. pour les cheveux secs à très secs ;fertilizing-serum-anti-chute-cheveux--soin-anti-chute-de-cheveux-p-image-257616-petite.png
ref0420;HUILE DE MOUTARDE Waam;;Shampooing doux hydratant et relaxant. réhydrate et assouplit la fibre capillaire des cheveux frisés, secs à très secs, crépus et indisciplinés. ;huile-de-moutarde-waam-p-image-265992-petite.png
ref0421;Bain Sucré Les Délices d\'Azylis;;Voir les détails;bain-sucre-les-delices-d-azylis-p-image-265722-petite.png
ref0422;Masque Soin Prolongateur de Lissage Activilong Actiliss;;Voir les détails;masque-soin-prolongateur-de-lissage-activilong-actiliss-p-image-260015-petite.png
ref0423;Hair Fertilizer;;Voir les détails;hair-fertilizer--creme-nourrissante-hydratante-cheveux-crepus-p-image-259973-petite.png
ref0424;Deep Moisturizing Masque Keracare Natural Textures;;Shampooing conditionneur à l\'Aloé, hydratant et protecteur, et à la fleur d\' Hibiscus, qui hydrate, renforce et assainit. Une texture crème qui ne mousse pas mais lave en douceur. Laisse les cheveux faciles à démêler, leur apporte un toucher soyeux et une belle brillance même sans après-shampoing !;deep-moisturizing-masque-keracare-natural-textures-p-image-260864-petite.png
ref0425;EASY POUSS Elixir Shandrani ;;Le Savon Nuage de Coco, c\'est 100 g de pure bonheur sur les épidermes les plus secs, sensibles et fragiles des enfants comme des adultes. A base de beurres végétaux bio de Karité et de Cacao, d\'huiles bio de Chanvre et Noyaux d\'Abricot et de Lait de Coco, ce savon est 100 % naturel. Extra riche, il ne contient ni parfum ni huiles essentielles. ;easy-pouss-elixir-shandrani--p-image-266681-petite.png
ref0426;Cure de Croissance Cheveux - 60 gélules;;Nutrition et douceur garanties avec ce Shampooing Fortifiant Actiforce qui nettoie le cuir chevelu en doucuer et le libère des impuretés tout en fortifiant les longueurs. 98% d\'origine naturelle, sans paraben, silicone, ni sulfate.;cure-de-croissance---60-gelules---curlista-p-image-266902-petite.png
ref0427;Root2Tip Root Energizer;;Hair Cleansing Cream de Jessicurl est un shampooing crémeux qui mousse peu mais nettoie et assouplit efficacement les textures épaisses, ultra sèches et les cheveux colorés.;root2tip-root-energizer-p-image-260442-petite.png
ref0428;T444Z Hair Food Baume Capillaire;;Voir les détails;t444z-hair-food-baume-capillaire-p-image-267665-petite.png
ref0429;Huile Capillaire De Croissance Les Secrets de Loly;;Le Shampooing Actiliss est enrichi à l\'huile d\'argan Bio, à la kératine pure et aux protéines de lait Bio. Il nourrit les cheveux, prolonge les effets du lissage et rend les cheveux doux et soyeux. ;huile-capillaire-de-croissance--p-image-261077-petite.png
ref0430;Sérum AntiChute SJR au Capixyl;;Extrêmement doux et sans aucun apport chimique, le savon noir African Black Soap Aviela s\'utilise sur la peau et sur les cheveux. Purifiant et antiseptique il préserve la jeunesse de la peau et laisse le teint lumineux.;serum-antichute-sjr-au-capixyl-p-image-267270-petite.png
ref0431;Programme Duo Entretien Root 2 Tip;;Shampooing Crème au Karité Equitable La Kaz Naturelle;programme-duo-entretien-root-2-tip-p-image-260995-petite.png
ref0432;Le Programme Maxi Boost Cheveux ;;Voir les détails;le-programme-maxi-boost-cheveux--p-image-261038-petite.png
ref0433;Cure de Kératine pour cheveux, peau et ongles - Curlista;;Shampooing sec idéal pour tresses, vanilles ou locks. ;cure-de-keratine---30-gelules---curlista-p-image-266903-petite.png
ref0434;Cure de Croissance Cheveux Curlista ;;Voir les détails;cure-de-croissance-cheveux-curlista-----p-image-267064-petite.png
ref0435;EAU FLORALE D\'HAMAMELIS WAAM;;Shampooing qui nettoie en douceur, aide à retirer les restes de colle et d\'huile dans vos cheveux. Il hydrate et aide à démêler;eau-florale-d-hamamelis-waam-p-image-266540-petite.png
ref0436;EAU FLORALE de LAVANDE WAAM;;Voir les détails;eau-florale-de-lavande-waam-p-image-266541-petite.png
ref0437;HUILE DE MOUTARDE Waam;;Co-Wash Crème lavante douce ACTICURL;huile-de-moutarde-waam-p-image-265992-petite.png
ref0438;Shampoing SJR Détox Gommant et Anti-Pelliculaire;;Le shampooing Réparateur Acti-REPAIR d\'Activilong fait la part belle à l\'huile d\'olive et d\'avocat, un duo de choc pour nourrir, réparer et renforcer les cheveux secs. Enrichi en vitamines E et F, en nutriments et en Oméga 3 et 6, ses agents nettoyants anti dessèchement protègent et gainent les cheveux sur toute leur longueur. Restructurés, nourris et hydratés, ils sont plus facile à coiffer et retrouvent force et vitalité;shampoing-sjr-detox-gommant-et-anti-pelliculaire-p-image-267269-petite.png
ref0439;Shampooing Antipelliculaire Keracare;;La Crème lavante douce d\'ACTIFORCE élimine les impuretés du cuir chevelu tout en douceur et procure un boost aux protéines végétales sans alourdir la chevelure. Grâce à sa texture non moussante et extra-douce, les noeuds sont limités et les cheveux démêlés pour favoriser la formation de belles boucles.;shampooing-antipelliculaire-keracare-p-image-258704-petite.png
ref0440;Conditionneur Hydratant antipelliculaire KeraCare;;Shampooing Crème à l\'Aloe. Les cheveux sont protégés, nourris et revitalisés. Particulièrement adapté aux cheveux frisés, secs ou crépus. ;conditionneur-hydratant-antipelliculaire-keracare-p-image-258675-petite.png
ref0441;huile d\'argan waam;;Shampooing clarifiant keracare Première Mousse, nettoie convenablement et efficacement tout type de cheveux, ne ternit pas le cheveu;huile-d-argan-100ml-p-image-261062-petite.png
ref0442;Reconstructive Elixir Raw Shea Butter de Shea Moisture;;Voir les détails;reconstructive-elixir-raw-shea-butter-de-shea-moisture-p-image-266650-petite.png
ref0443;Sérum de réparation cheveux et cuir chevelu Raw Shea Butter Shea Moisture;;Shampoing Clean & Natural Herbal Hair Wash Taliah Waajid;serum-de-reparation-cheveux-et-cuir-chevelu-raw-shea-butter-shea-moisture-p-image-266663-petite.png
ref0444;Raw Shea Butter Damage Repair Hair & Scalp Serum 59ml;;Voir les détails;raw-shea-butter-damage-repair-hair-scalp-serum-59ml-p-image-266656-petite.png
