ref0002;Shampooing Hydratant et Démêlant sans sulfate Keracare;;shampoing KeraCare sans sulfate, nettoie, démêle, et assouplit avec efficacité;shampooing-hydratant-et-demelant-sans-sulfate-keracare-p-image-258556-petite.png
ref0003;Curlicious Curls Cleansing Cream;;Un shampoing à la texture crèmeuse douce pour nettoyer sans irriter ni dessécher les cheveux les plus secs et fragiles, hydratation en profondeur des cheveux.;curlicious-curls-cleansing-cream-p-image-260667-petite.png
ref0004;Moisture Retention Shampoo Shea Butter de Shea Moisture;;Raw Shea Butter - Shampooing de rétention d\'humidité il hydrate, adoucit et comble les brèches , laisse les cheveux maniables et soyeux. ;moisture-retention-shampoo-shea-butter-de-shea-moisture--p-image-266647-petite.png
ref0005;Shampooing Curl and Shine Shampoo Shea Moisture;;Le Shampoing Curl and Shine à base d\'hibiscus démêle, hydrate et définit les boucles en restaurant la fibre capillaire et la brillance. L\'huile de Coco nourrit en profondeur, les protéines de soie renforcent, l\'huile de Neem laisse le cheveu sain et brillant.;shea-moisture-shampooing-curl-and-shine-shampoo-p-image-266646-petite.png
ref0006;Shampoing Reconstructeur Jamaïcan Black Castor Oil;;Un shampoing reconstructeur sans sulfates qui élimine l\'accumulation de produits, tout en hydratant le cuir chevelu. Un soin cheveu intégral qui renforce la fibre capillaire de l\'intérieur. Excellent pour les cheveux affaiblis, abîmés, cassants et fourchus. ;shampoing-reconstructeur-jamaican-black-castor-oil-p-image-266659-petite.png
ref0007;Shampoing Bio Doobaline;;Shampooing Bio à l\'huile de Moringa, dès 3 ans. pour les cheveux secs à très secs ;shampoing-bio-doobaline-p-image-264879-petite.png
ref0008;Shampooing Crème Eclat Ebène;;Shampooing doux hydratant et relaxant. réhydrate et assouplit la fibre capillaire des cheveux frisés, secs à très secs, crépus et indisciplinés. ;shampooing-creme-eclat--p-image-260023-petite.png
ref0009;Savon Noir naturel Dudu Osun 25 grammes ;;Savon Noir naturel Dudu Osun 25 grammes en format découverte. ;savon-noir-naturel-dudu-osun-25-grammes--p-image-265947-petite.png
ref0010;Shampooing solide au Karité Equitable ;;Shampooing solide au Karité Equitable ;shampooing-solide-au-karite-equitable--p-image-261114-petite.png
ref0011;Shampooing Activateur de Boucles Activilong ACTICURL Hydra;;Shampooing Activateur de Boucles ACTICURL;shampooing-activateur-de-boucles-activilong-acticurl-hydra-p-image-264055-petite.png
ref0012;Shampooing Conditionneur Activilong NATURAL TOUCH;;Shampooing conditionneur à l\'Aloé, hydratant et protecteur, et à la fleur d\' Hibiscus, qui hydrate, renforce et assainit. Une texture crème qui ne mousse pas mais lave en douceur. Laisse les cheveux faciles à démêler, leur apporte un toucher soyeux et une belle brillance même sans après-shampoing !;shampooing-conditionneur-activilong-natural-touch-p-image-260008-petite.png
ref0013;Savon Nuage de Coco Noire ô Naturel;;Le Savon Nuage de Coco, c\'est 100 g de pure bonheur sur les épidermes les plus secs, sensibles et fragiles des enfants comme des adultes. A base de beurres végétaux bio de Karité et de Cacao, d\'huiles bio de Chanvre et Noyaux d\'Abricot et de Lait de Coco, ce savon est 100 % naturel. Extra riche, il ne contient ni parfum ni huiles essentielles. ;savon-nuage-de-coco-noire-o-naturel-p-image-261000-petite.png
ref0014;SHAMPOING Fortifiant ACTIFORCE;;Nutrition et douceur garanties avec ce Shampooing Fortifiant Actiforce qui nettoie le cuir chevelu en doucuer et le libère des impuretés tout en fortifiant les longueurs. 98% d\'origine naturelle, sans paraben, silicone, ni sulfate.;shampoing-fortifiant-actiforce-p-image-267045-petite.png
ref0015;shampoing Hair Cleansing Cream Jessicurl;;Hair Cleansing Cream de Jessicurl est un shampooing crémeux qui mousse peu mais nettoie et assouplit efficacement les textures épaisses, ultra sèches et les cheveux colorés.;shampoing-hair-cleansing-cream-jessicurl-p-image-258889-petite.png
ref0016;Shampooing prolongateur de lissage Activilong Actiliss;;Le Shampooing Actiliss est enrichi à l\'huile d\'argan Bio, à la kératine pure et aux protéines de lait Bio. Il nourrit les cheveux, prolonge les effets du lissage et rend les cheveux doux et soyeux. ;shampooing-prolongateur-de-lissage-activilong-actiliss-p-image-260014-petite.png
ref0017;Pain Savon Noir Aviela ;;Extrêmement doux et sans aucun apport chimique, le savon noir African Black Soap Aviela s\'utilise sur la peau et sur les cheveux. Purifiant et antiseptique il préserve la jeunesse de la peau et laisse le teint lumineux.;pain-savon-noir-aviela-p-image-267203-petite.png
ref0018;Shampooing Crème au Karité Equitable La Kaz Naturelle;;Shampooing Crème au Karité Equitable La Kaz Naturelle;shampooing-creme-au-karite-equitable-la-kaz-naturelle-p-image-264320-petite.png
ref0019;Savon Noire o naturel Un Amour de Tortilles ;;Shampooing sec idéal pour tresses, vanilles ou locks. ;savon-noire-o-naturel-un-amour-de-tortilles--p-image-259808-petite.png
ref0020;Shampooing Nettoyant Après Tissage Weave RX Organic Root Stimulator;;Shampooing qui nettoie en douceur, aide à retirer les restes de colle et d\'huile dans vos cheveux. Il hydrate et aide à démêler;shampooing-nettoyant-apres-tissage-weave-rx-organic-root-stimulator-p-image-259722-petite.png
ref0021;Co-Wash Crème lavante douce Activilong ACTICURL Hydra;;Co-Wash Crème lavante douce ACTICURL;co-wash-creme-lavante-douce-activilong-acticurl-hydra-p-image-264056-petite.png
ref0022;Shampooing Réparateur ACTIREPAIR;;Le shampooing Réparateur Acti-REPAIR d\'Activilong fait la part belle à l\'huile d\'olive et d\'avocat, un duo de choc pour nourrir, réparer et renforcer les cheveux secs. Enrichi en vitamines E et F, en nutriments et en Oméga 3 et 6, ses agents nettoyants anti dessèchement protègent et gainent les cheveux sur toute leur longueur. Restructurés, nourris et hydratés, ils sont plus facile à coiffer et retrouvent force et vitalité;shampooing-reparateur-actirepair-p-image-260016-petite.png
ref0023;COWASH Crème Lavante Douce ACTIFORCE;;La Crème lavante douce d\'ACTIFORCE élimine les impuretés du cuir chevelu tout en douceur et procure un boost aux protéines végétales sans alourdir la chevelure. Grâce à sa texture non moussante et extra-douce, les noeuds sont limités et les cheveux démêlés pour favoriser la formation de belles boucles.;cowash-creme-lavante-douce-actiforce-p-image-267042-petite.png
ref0024;Shampooing Crème à l\'Aloe Organic Root Stimulator;;Shampooing Crème à l\'Aloe. Les cheveux sont protégés, nourris et revitalisés. Particulièrement adapté aux cheveux frisés, secs ou crépus. ;shampooing-creme-a-l-aloe-organic-root-stimulator-p-image-257626-petite.png
ref0025;Uplifting Shampoo Réparateur Organic Root Stimulator;;shampoing clarifiant organic root stimulator à utiliser en alternance. Stimulant et revitalisant. Il élimine les résidus chimiques accumulés. Les pores obstrués se libèrent. il est adapté aux cheveux secs et défrisés;uplifting-shampoo-reparateur-organic-root-stimulator-p-image-259226-petite.png
ref0026;Shampooing Première Mousse Keracare;;Shampooing clarifiant keracare Première Mousse, nettoie convenablement et efficacement tout type de cheveux, ne ternit pas le cheveu;shampooing-premiere-mousse-keracare-p-image-258672-petite.png
ref0027;Shampoing Clean & Natural Herbal Hair Wash Taliah Waajid;;Shampoing Clean & Natural Herbal Hair Wash Taliah Waajid;shampoing-clean---natural-herbal-hair-wash-taliah-waajid-p-image-266125-petite.png
ref0028;Shampoing Magic SJR;;Shampoing Magic SJR;shampoing-magic-sjr-p-image-263595-petite.png
ref0029;Shampooing à la menthe poivrée - Africare;;Ce shampooing purifiant Africare assure un nettoyage en profondeur. Il élimine en douceur les impuretés sans décaper. Les cheveux et le cuir chevelu sont assainis de la racine à la pointe. Particulièrement adapté aux cheveux frisés, secs, crépus et les toutes les coiffures africaines : tresses, vanilles, locks.;shampooing-a-la-menthe-poivree-africare-p-image-257514-petite.png
ref0030;Shampoing sec herbal d\'organic Root;;Herbal Cleanse Shampooing sec pour tresses et locks;herbal-cleanse-shampooing-p-image-259877-petite.png
ref0031;Pré-Shampooing Stimulating Herbal Cleanser Black Earth;;Shampooing clarifiant locks et cheveux crépus. Il élimine les résidus de coiffage, assainit et stimule le cuir chevelu.;pre-shampooing-stimulating-herbal-cleanser-black-earth-p-image-259893-petite.png
ref0032;Shampooing Hydratant pour cheveux colorés Keracare;;nettoie les cheuveux.réhausse, prolonge et hydrate les cheveux colorés;shampooing-hydratant-pour-cheveux-colores-keracare-p-image-258674-petite.png
ref0033;Clean n\' Curly Taliah Waajid;; Pour nettoyer en douceur et apporter brillance et hydratation aux cheveux crépus, frisés. Enrichi en acides aminés de soie. ;clean-n--curly-taliah-waajid-p-image-259897-petite.png
ref0034;Honey Shea Co-Wash Keracare Natural Texture;;Formulé à base d\'ingrédients naturels comme le Miel, le beurre de Karité, les extraits d\'Amla et de Shikakai, le Neem, les huiles d\'Argan, d\'Abyssinie et de Ricin, Honey Shea Co-Wash de Keracare Natural Textures lave efficacement et en douceur les cheveux afro. Ils sont plus forts, plus brillants et plus faciles à démêler. ;honey-shea-co-wash--keracare-co-wash--co-wash-cheveux--co-wash-honey--co-wash-cheveux-crepus-p-image-260793-petite.png
ref0035;Crème sucrée Les Délices d\'Azylis;;Crème sucrée Les Délices d\'Azylis;creme-sucree-les-delices-d-azylis-p-image-265859-petite.png
ref0036;Base Neutre Shampoing sans Sulfate Waam-;;Cette base shampooing sans sulfate produit une mousse abondante pour nettoyer et démêler les cheveux en profondeur sans dessécher. Neutre et enrichie en Aloe et glycérine végétale, elle convient à un usage fréquent, pour toute la famille. -;base-neutre-shampoing-sans-sulfate-waam--p-image-266792-petite.png
ref0037;As I Am Curl Clarity Shampoo ;;Curl Clarity de AS I AM est un shampoing clarifiant qui nettoie et élimine tous les résidus et produits accumulés sur votre cuir chevelu. Sans sulfate, il préserve la couleur des cheveux colorés et permet à vos boucles de retrouver leur vigueur.;as-i-am-curl-clarity-shampoo--p-image-266815-petite.png
ref0038;Total Body Shampoo Taliah Waajid;;shampoing Sans silicone. Idéal cheveux afro. Il pénètre en profondeur pour restaurer l\'hydratation, restructurer et promouvoir une croissance plus active.;total-body-shampoo-taliah-waajid-p-image-257769-petite.png
ref0039;Shampoing SJR Détox Gommant et Anti-Pelliculaire;;Le shampoing détoxifie nettoie et purifie le cuir chevelu grace à sont actif bio anti pelliculaire le bois de panama complété par les poudres de coco et bambou qui vont gommer et éliminer toutes les impuretés collées aux racines. Il contient également un actif naturel, le syricalm qui apaise les cuirs chevelu les plus irrités et fragilisés.;shampoing-sjr-detox-gommant-et-anti-pelliculaire-p-image-267269-petite.png
ref0040;Shampoing Crème nettoyant Thermal Wonder ;;Shampoing Crème nettoyant Thermal Wonder ;shampoing-creme-nettoyant-thermal-wonder-------p-image-267024-petite.png
ref0041;Shampooing Pure Curls Clarifying Shampoo Curls ;;Shampoing clarifiant détoxifiant sans sulfate pour cheveux afro, crépus, frisés ou bouclés. ;shampooing-pure-curls-clarifying-shampoo-curls--p-image-260661-petite.png
ref0042;Shampooing Antipelliculaire Keracare;; shampoing qui traite avec efficacité les pellicules sur cheveux afro et évitent les recidives;shampooing-antipelliculaire-keracare-p-image-258704-petite.png
ref0043;Crème Nettoyante Keracare Natural Textures;; lave les cheveux et le cuir chevelu. Les démangeaisons du cuir chevelu sont apaisées. Les résidus de coiffage sont parfaitement éliminés.les cheveux sont plus souples et faciles à coiffer. ;creme-nettoyante-keracare-natural-textures-p-image-260508-petite.png
ref0044;Shampoing Romarin & Noix de Coco Curls Unleashed;;Shampoing Romarin & Noix de Coco Curls Unleashed;shampoing-romarin---noix-de-coco-curls-unleashed-p-image-265376-petite.png
ref0045;Shampooing Clarifiant Nappy Queen;;Ce shampooing clarifiant fluide nettoie en profondeur et élimine les dépôts et résidus sans froisser ni assécher la structure des boucles. Il purifie les cheveux crépus locksés, les cheveux secs ou bouclés.;shampooing-clarifiant-nappy-queen-p-image-266891-petite.png
ref0046;Shampoing Perfect Clean Les Secrets de Loly;;Le shampooing Perfect Clean garantit un bon équilibre et nettoie les cheveux en douceur sans dessécher. Il convient aux cheveux naturels, traités chimiquement, bouclés, frisés, crépus, et même lisses.;shampoing-perfect-clean-les-secrets-de-loly-p-image-260064-petite.png
ref0047;Fruit Fusion Coconut Water Weightless Shampoo;;Fruit Fusion Coconut Water Weightless Shampoo;fruit-fusion-coconut-water-weightless-shampoo-p-image-267189-petite.png
ref0048;Shampoing enfant Frizouilles et Cie;;le shampoing démêlant et hydratant pour enfant, il lave en douceur, démêle, prépare au coiffage et redéfinit les boucles des cheveux bouclés, frisés, métissés ou crépus naturels.;shampoing-enfant-frizouilles-et-cie-p-image-259804-petite.png
ref0049;Shampooing Doux Nappy Queen;;Un shampooing nourrissant qui nettoie délicatement les cheveux cheveux bouclés, frisés, crépus et défrisés en leur donnant vitalité et élasticité. Démêle en préservant de la déshydratation.;shampooing-doux-nappy-queen-p-image-266890-petite.png
ref0050;Shampoing Curls Blueberry Bliss Reparative HAIR WASH;;Sans Sulfates, Silicones, Parabene, ni huiles minérales, la formule ultra douce du Shampooing Reparative Hair Wash de la gamme Bluberry bliss de la marque CURLS a de nombreux ingrédients naturels. Conçu pour les cheveux naturellement bouclés, frisés, ondulés ou crépus, il lave en douceur hydrate les cheveux en profondeur et peut être utilisé tous les jours. Contenance : 240ml;shampoing-curls-blueberry-bliss-reparative-hair-wash-p-image-267066-petite.png
ref0051;Lot de 6 Savons Dudu Osun Tropical Naturals;;Lot de 6 Savons Dudu Osun Tropical Naturals;lot-de-6-savons-dudu-osun-tropical-naturals-p-image-267714-petite.png
ref0052;Crème de Shampooing Bio Noire o Naturel;;Crème de shampooing sans sulfate composée de beurres végétaux et d\'aloe vera bio reconnus pour leurs bienfaits capillaires. Sa base lavante végétale extra-douce lui confère sa texture crémeuse, non-moussante, pour nettoyer le cheveu en douceur.;creme-de-shampooing-bio-noire-o-naturel-p-image-259183-petite.png
ref0053;Gentle Clarifying Shampoo Mixed Chicks ;;Shampoing pour cheveux bouclés et métissés;gentle-clarifying-shampoo-mixed-chicks-p-image-258873-petite.png
ref0054;Shampooing sans sulfate Mixed Chicks;;Shampooing Mixed Chicks sans Sulfate lave en douceur les cheveux frisés, bouclés.;shampooing--mixed-chicks-sans-sulfate-p-image-259199-petite.png
ref0055;Gentle Lather Shampoo;;Ses agents lavants doux nettoient en profondeur sans décaper. Sans hydratant gras, Gentle Lather Shampoo de Jessicurl n\'alourdit pas les cheveux. Les boucles sont propres, douces et bien définies.;gentle-lather-shampoo-p-image-260554-petite.png
ref0056;Shampooing Natural Amande et Avocat 237ml;;Le shampooing démêlant et hydratant sans sulfate, à l\'amande et à l\'avocat de Design Essentials, hydrate, adoucit et démêlent même les cheveux les plus bouclés, frisés, crépus.;shampooing-natural-amande-et-avocat-237ml-p-image-260857-petite.png
ref0057; Shampooing Equilibre d\'Hydratation Root2tip;; Il apporte aux cheveux secs, crépus,bouclés hydratation, brillance et douceur en nettoyant en profondeur le cuir chevelu. ;shampooing-equilibre-d-hydratation-root2tip-p-image-260991-petite.png
ref0058;SHAMPOOING NOURRISSANT À LA NOIX DE COCO;;Au tournesol et à l\'huile de coco, ce shampooing ultra-hydratant sans sulfate enlève impuretés et résidus du cheveu et du cuir chevelu. Il rétablit le niveau naturel d\'hydratation du cheveu, redéfinit les boucles tout en leur redonnant une souplesse, un éclat et une brillance plus soutenus. ;shampooing-nourrissant-a-la-noix-de-coco--p-image-265934-petite.png
ref0059;Shampooing Nourissant Natural Design Essentials;;Shampooing Nourissant Natural Design Essentials;shampooing-nourissant-natural-design-essentials-p-image-265051-petite.png
ref0060;Modes de paiement et d\'expédition;;Modes de paiement et d\'expédition;modes-de-paiement-et-d-expedition-image-265840-moyenne.png
ref0061;Leave In Conditioner, laits et lotions;;shampooing cheveux crépus;leave-in-conditioner-image-264077-moyenne.jpg
ref0062;Curl and Style Milk Shea Moisture Lait Coiffant;;shampoing KeraCare sans sulfate, nettoie, démêle, et assouplit avec efficacité;curl-and-style-milk-shea-moisture-lait-coiffant-p-image-266651-petite.png
ref0063;Raw Shea Butter Extra Moisture Transitioning Milk de Shea Moisture;;Voir les détails;raw-shea-butter-extra-moisture-transitioning-milk-de-shea-moisture-p-image-266655-petite.png
ref0064;Extra Moisture Detangler Raw Shea Butter de Shea Moisture;;Un shampoing à la texture crèmeuse douce pour nettoyer sans irriter ni dessécher les cheveux les plus secs et fragiles, hydratation en profondeur des cheveux.;extra-moisture-detangler-raw-shea-butter-de-shea-moisture-p-image-266657-petite.png
ref0065;Leave In Jamaican Black Castor Oil de Shea Moisture;;Raw Shea Butter - Shampooing de rétention d\'humidité il hydrate, adoucit et comble les brèches , laisse les cheveux maniables et soyeux. ;leave-in-jamaican-black-castor-oil-de-shea-moisture-p-image-266660-petite.png
ref0066;Strengthen Grow & Restore Styling Lotion - Jamaican Black Castor Oil Shea Moisture;;Le Shampoing Curl and Shine à base d\'hibiscus démêle, hydrate et définit les boucles en restaurant la fibre capillaire et la brillance. L\'huile de Coco nourrit en profondeur, les protéines de soie renforcent, l\'huile de Neem laisse le cheveu sain et brillant.;strengthen-grow---restore-styling-lotion-jamaican-black-castor-oil-p-image-266662-petite.png
ref0067;Lait coiffant NATURAL TOUCH;;Un shampoing reconstructeur sans sulfates qui élimine l\'accumulation de produits, tout en hydratant le cuir chevelu. Un soin cheveu intégral qui renforce la fibre capillaire de l\'intérieur. Excellent pour les cheveux affaiblis, abîmés, cassants et fourchus. ;lait-coiffant-natural-touch-p-image-260011-petite.png
ref0068;Leave In Confident Coils Styling Solution Jessicurl;;Shampooing Bio à l\'huile de Moringa, dès 3 ans. pour les cheveux secs à très secs ;leave-in-confident-coils-styling-solution-jessicurl-p-image-260557-petite.png
ref0069;Aloeba Daily Conditioner Jessicurl;;Savon Noir naturel Dudu Osun 25 grammes en format découverte. ;aloeba-daily-conditioner-jessicurl-p-image-260558-petite.png
ref0070;Lotion Rockin\' Ringlets Jessicurl ;;Shampooing solide au Karité Equitable ;lotion-rockin--ringlets-jessicurl-p-image-260553-petite.png
ref0071;Lotion Coiffante Hydratante Olive Oil Organic Root Stimulator;;Voir les détails;lotion-coiffante-hydratante-olive-oil-organic-root-stimulator-p-image-259975-petite.png
ref0072;ORS. Curls Unleashed Hair Milk 236ml;;Voir les détails;ors-curls-unleashed-hair-milk-236ml-p-image-264683-petite.png
ref0073;Leave-in ACTICURL sans rinçage ;;Voir les détails;leave-in-sans-rincage-activilong-acticurl-hydra-p-image-264057-petite.png
ref0074;LEAVE IN Soin sans Rinçage ACTIFORCE;;Nutrition et douceur garanties avec ce Shampooing Fortifiant Actiforce qui nettoie le cuir chevelu en doucuer et le libère des impuretés tout en fortifiant les longueurs. 98% d\'origine naturelle, sans paraben, silicone, ni sulfate.;leave-in--soin-sans-rincage-actiforce-p-image-267040-petite.png
ref0075;Humecteur à l\'Huile de Jojoba - Oil Moisturizer Keracare;;Hair Cleansing Cream de Jessicurl est un shampooing crémeux qui mousse peu mais nettoie et assouplit efficacement les textures épaisses, ultra sèches et les cheveux colorés.;humecteur-a-l-huile-de-jojoba-keracare-p-image-258709-petite.png
ref0076;As I Am Leave In Conditioner;;Le Shampooing Actiliss est enrichi à l\'huile d\'argan Bio, à la kératine pure et aux protéines de lait Bio. Il nourrit les cheveux, prolonge les effets du lissage et rend les cheveux doux et soyeux. ;as-i-am-leave-in-conditioner-p-image-266813-petite.png
ref0077;Lait Capillaire sans rinçage Ricin et Tea Tree La Kaz Naturelle;;Voir les détails;lait-capillaire-sans-rincage-ricin-et--tea-tree-la-kaz-naturelle-p-image-264324-petite.png
ref0078;The Great Detangler Black Earth;;Shampooing Crème au Karité Equitable La Kaz Naturelle;the-great-detangler-black-earth--soin-demelant-cheveux-naturels-p-image-258729-petite.png
ref0079;Leave In Conditioner Sans Rinçage Keracare Natural Textures;;Voir les détails;leave-in-conditioner-sans-rincage--keracare-leave-in-conditioner-p-image-259983-petite.png
ref0080;Leave-in Conditioner Curls Unleashed;;Voir les détails;leave-in-conditioner-curls-unleashed-p-image-263614-petite.png
ref0081;Baume Magic SJR;;Voir les détails;baume-magic-sjr-p-image-263597-petite.png
ref0082;Shea Coco Natural Hair Condition Daily Leave in Conditioner Tailiah Waajid;;Voir les détails;shea-coco-natural-hair-condition-daily-leave-in-conditioner-tailiah-waajid-p-image-265864-petite.png
ref0083;As I Am So Much Moisture ;;La Crème lavante douce d\'ACTIFORCE élimine les impuretés du cuir chevelu tout en douceur et procure un boost aux protéines végétales sans alourdir la chevelure. Grâce à sa texture non moussante et extra-douce, les noeuds sont limités et les cheveux démêlés pour favoriser la formation de belles boucles.;as-i-am-so-much-moisture--p-image-266823-petite.png
ref0084;Curls BLUEBLERRY BLISS REPARATIVE LEAVE IN-;;Shampooing Crème à l\'Aloe. Les cheveux sont protégés, nourris et revitalisés. Particulièrement adapté aux cheveux frisés, secs ou crépus. ;curls-blueblerry-bliss-reparative-leave-in--p-image-267065-petite.png
ref0085;Conditionneur de maintien sans rinçage Keracare;;shampoing clarifiant organic root stimulator à utiliser en alternance. Stimulant et revitalisant. Il élimine les résidus chimiques accumulés. Les pores obstrués se libèrent. il est adapté aux cheveux secs et défrisés;conditionneur-de-maintien-sans-rincage-keracare-p-image-258679-petite.png
ref0086;KeraCare Natural Texture Hair Milk Keracare Natural Textures;;Voir les détails;keracare-lait-capillaire--keracare-hair-milk-p-image-259977-petite.png
ref0087;leave in conditioner sans rincage Design Essentials;;Shampoing Clean & Natural Herbal Hair Wash Taliah Waajid;leave-in-conditioner-sans-rincage-design-essentials-p-image-260385-petite.png
ref0088;Lait capillaire Triple M Root2Tip;;Shampoing Magic SJR;lait-capillaire-triple-m-root2tip-p-image-259899-petite.png
ref0089;Lotion Naturelle Hydratante Design Essentials;;Voir les détails;lotion-naturelle-hydratante---design-essentials-p-image-260388-petite.png
ref0090;As I Am Moisture Milk ;;Herbal Cleanse Shampooing sec pour tresses et locks;as-i-am-moisture-milk--p-image-266812-petite.png
ref0091;Lait Capillaire Nappy Queen;;Voir les détails;lait-capillaire-nappy-queen-p-image-266894-petite.png
ref0092;Curls Milkshake - Boucles onctueuses;;Shampooing clarifiant locks et cheveux crépus. Il élimine les résidus de coiffage, assainit et stimule le cuir chevelu.;curls-milkshake---boucles-onctueuses-p-image-260670-petite.png
ref0093;LAIT CAPILLAIRE SMOOTHIE ANANAS Les Secrets de Loly;;Voir les détails;lait-capillaire-smoothie-ananas---p-image-257679-petite.png
ref0094;Deep Moisture Milk Cream;;nettoie les cheuveux.réhausse, prolonge et hydrate les cheveux colorés;deep-moisture-milk-cream-p-image-263604-petite.png
ref0095;Lait Sublimateur de Boucles Double Hydratation;; Pour nettoyer en douceur et apporter brillance et hydratation aux cheveux crépus, frisés. Enrichi en acides aminés de soie. ;lait-sublimateur-de-boucles-double-hydratation-p-image-263611-petite.png
ref0096;LAIT NOURRISSANT SANS RINÇAGE À LA NOIX DE COCO;;Voir les détails;lait-nourrissant-sans-rincage-a-la-noix-de-coco-p-image-265933-petite.png
ref0097;Mixed Chicks Leave In Conditionner;;Voir les détails;leave-in-conditioner-mixed-chicks-p-image-258872-petite.png
ref0098;Lait Capillaire Smoothie Vanille-Ylang (Hydratant) 250 Ml ;;Cette base shampooing sans sulfate produit une mousse abondante pour nettoyer et démêler les cheveux en profondeur sans dessécher. Neutre et enrichie en Aloe et glycérine végétale, elle convient à un usage fréquent, pour toute la famille. -;lait-capillaire-smoothie-vanille-ylang--hydratant--250-ml-p-image-257802-petite.png
ref0099;Lait Capillaire Smoothie Litchi Mure Les Secrets de Loly;;Curl Clarity de AS I AM est un shampoing clarifiant qui nettoie et élimine tous les résidus et produits accumulés sur votre cuir chevelu. Sans sulfate, il préserve la couleur des cheveux colorés et permet à vos boucles de retrouver leur vigueur.;lait-capillaire-smoothie-litchi-mure--p-image-258698-petite.png
ref0100;Modes de paiement et d\'expédition;; shampoing qui traite avec efficacité les pellicules sur cheveux afro et évitent les recidives;modes-de-paiement-et-d-expedition-image-265840-moyenne.png
ref0101;Gels coiffants;;shampooing cheveux crépus;gels-coiffants-image-264079-moyenne.jpg
ref0102;Eco Styler Olive Oil Styling Gel 710ml;;shampoing KeraCare sans sulfate, nettoie, démêle, et assouplit avec efficacité;eco-styler-olive-oil-styling-gel-710ml-p-image-265993-petite.png
